Authors,Title,Pasquale,Mary,Overall,Motivation,Year,Link,Abstract,Publication Stage,Open Access,Manually added
Martín-Chozas P.; Ahmadi S.; Montiel-Ponsoda E.,Defying wikidata: Validation of terminological relations in the web of data,1,1,1,#use,2020,https://www.scopus.com/inward/record.uri?eid=2-s2.0-85096530716&partnerID=40&md5=8658e3c7154fd8ea391e1f3a2b1933ab,"In this paper we present an approach to validate terminological data retrieved from open encyclopaedic knowledge bases. This need arises from the enrichment of automatically extracted terms with information from existing resources in the Linguistic Linked Open Data cloud. Specifically, the resource employed for this enrichment is WIKIDATA, since it is one of the biggest knowledge bases freely available within the Semantic Web. During the experiment, we noticed that certain RDF properties in the Knowledge Base did not contain the data they are intended to represent, but a different type of information. In this paper we propose an approach to validate the retrieved data based on four axioms that rely on two linguistic theories: the x-bar theory and the multidimensional theory of terminology. The validation process is supported by a second knowledge base specialised in linguistic data; in this case, CONCEPTNET. In our experiment, we validate terms from the legal domain in four languages: Dutch, English, German and Spanish. The final aim is to generate a set of sound and reliable terminological resources in RDF to contribute to the population of the Linguistic Linked Open Data cloud. © European Language Resources Association (ELRA), licensed under CC-BY-NC",Final,,
Gracia J.; Fäth C.; Hartung M.; Ionov M.; Bosque-Gil J.; Veríssimo S.; Chiarcos C.; Orlikowski M.,Leveraging Linguistic Linked Data for Cross-Lingual Model Transfer in the Pharmaceutical Domain,1,1,1,#use,2020,https://www.scopus.com/inward/record.uri?eid=2-s2.0-85096625207&doi=10.1007%2f978-3-030-62466-8_31&partnerID=40&md5=4760f3754c42b51d2fd3ed570ec01f69,"We describe the use of linguistic linked data to support a cross-lingual transfer framework for sentiment analysis in the pharmaceutical domain. The proposed system dynamically gathers translations from the Linked Open Data (LOD) cloud, particularly from Apertium RDF, in order to project a deep learning-based sentiment classifier from one language to another, thus enabling scalability and avoiding the need of model re-training when transferred across languages. We describe the whole pipeline traversed by the multilingual data, from their conversion into RDF based on a new dynamic and flexible transformation framework, through their linking and publication as linked data, and finally their exploitation in the particular use case. Based on experiments on projecting a sentiment classifier from English to Spanish, we demonstrate how linked data techniques are able to enhance the multilingual capabilities of a deep learning-based approach in a dynamic and scalable way, in a real application scenario from the pharmaceutical domain. © 2020, Springer Nature Switzerland AG.",Final,All Open Access; Green Open Access,
Simov K.,Integrated Language and Knowledge Resources for a Bulgarian-Centric Knowledge Graph,1,1,1,#use #integration,2019,https://www.scopus.com/inward/record.uri?eid=2-s2.0-85084240830&partnerID=40&md5=f16110765eac6784e8dd66b825ae97ed,"This paper reports on the integration of language and knowledge resources within CLaDA-BG infrastructure. The idea is to encode linguistic knowledge on all levels of language starting from text, grammatical annotation and lemmatization to semantic and conceptual annotation. Our goal is to support conceptual annotation of various research objects (mainly texts). One of the main applications will be the management of a Bulgaria-centric Knowledge Graph. © 2019 Digital Presentation and Preservation of Cultural and Scientific Heritage. All rights reserved.",Final,,
Sakor A.; Mulang I.O.; Singh K.; Shekarpour S.; Vidal M.-E.; Lehmann J.; Auer S.,Old is gold: Linguistic driven approach for entity and relation linking of short text,1,,1,#use,2019,https://www.scopus.com/inward/record.uri?eid=2-s2.0-85081090168&partnerID=40&md5=d93ebebd95c7e03c292d4b885c224512,"Short texts challenge NLP tasks such as named entity recognition, disambiguation, linking and relation inference because they do not provide sufficient context or are partially malformed (e.g. wrt. capitalization, long tail entities, implicit relations). In this work, we present the Falcon approach which effectively maps entities and relations within a short text to its mentions of a background knowledge graph. Falcon overcomes the challenges of short text using a light-weight linguistic approach relying on a background knowledge graph. Falcon performs joint entity and relation linking of a short text by leveraging several fundamental principles of English morphology (e.g. compounding, headword identification) and utilizes an extended knowledge graph created by merging entities and relations from various knowledge sources. It uses the context of entities for finding relations and does not require training data. Our empirical study using several standard benchmarks and datasets show that Falcon significantly outperforms state-of-the-art entity and relation linking for short text query inventories. © 2019 Association for Computational Linguistics",Final,,
Chiarcos C.; Ionov M.,Ligt: An LLod-native vocabulary for representing interlinear glossed text as RDF,1,,1,#use,2019,https://www.scopus.com/inward/record.uri?eid=2-s2.0-85068056004&doi=10.4230%2fOASIcs.LDK.2019.3&partnerID=40&md5=1194a6ce49aa6b6b03fd05f91410d0ce,"The paper introduces Ligt, a native RDF vocabulary for representing linguistic examples as text with interlinear glosses (IGT) in a linked data formalism. Interlinear glossing is a notation used in various fields of linguistics to provide readers with a way to understand linguistic phenomena and to provide corpus data when documenting endangered languages. This data is usually provided with morpheme-by-morpheme correspondence which is not supported by any established vocabularies for representing linguistic corpora or automated annotations. Interlinear Glossed Text can be stored and exchanged in several formats specifically designed for the purpose, but these differ in their designs and concepts, and they are tied to particular tools, so the reusability of the annotated data is limited. To improve interoperability and reusability, we propose to convert such glosses to a tool-independent representation well-suited for the Web of Data, i.e., a representation in RDF. Beyond establishing structural (format) interoperability by means of a common data representation, our approach also allows using shared vocabularies and terminology repositories available from the (Linguistic) Linked Open Data cloud. We describe the core vocabulary and the converters that use this vocabulary to convert IGT in a format of various widely-used tools into RDF. Ultimately, a Linked Data representation will facilitate the accessibility of language data from less-resourced language varieties within the (Linguistic) Linked Open Data cloud, as well as enable novel ways to access and integrate this information with (L)LOD dictionary data and other types of lexical-semantic resources. In a longer perspective, data currently only available through these formats will become more visible and reusable and contribute to the development of a truly multilingual (semantic) web. © Christian Chiarcos and Maxim Ionov.",Final,,
Cremaschi M.; Bianchi F.; Maurino A.; Pierotti A.P.,Supporting journalism by combining neural language generation and knowledge graphs,1,,1,#use,2019,https://www.scopus.com/inward/record.uri?eid=2-s2.0-85074854423&partnerID=40&md5=deed4622ec53e2a0fcdc4b44f6eb420e,"Natural Language Generation is a field that is becoming relevant in several domains, including journalism. Natural Language Generation techniques can be of great help to journalists, allowing a substantial reduction in the time required to complete repetitive tasks. In this position paper, we enforce the idea that automated tools can reduce the effort required to journalist when writing articles; at the same time we introduce GazelLex (Gazette Lexicalization), a prototype that covers several steps of Natural Language Generation, in order to create soccer articles automatically, using data from Knowledge Graphs, leaving journalists the possibility of refining and editing articles with additional information. We shall present our first results and current limits of the approach, and we shall also describe some lessons learned that might be useful to readers that want to explore this field. Copyright 2019 for this paper by its authors.",Final,,
Chiarcos C.; Pagé-Perron É.; Khait I.; Schenk N.; Reckling L.,Towards a linked open data edition of sumerian corpora,1,,1,#use,2019,https://www.scopus.com/inward/record.uri?eid=2-s2.0-85056772672&partnerID=40&md5=9c5604b58788ffbe8e0b5eee8b7c38aa,"Linguistic Linked Open Data (LLOD) is a flourishing line of research in the language resource community, so far mostly adopted for selected aspects of linguistics, natural language processing and the semantic web, as well as for practical applications in localization and lexicography. Yet, computational philology seems to be somewhat decoupled from the recent progress in this area: even though LOD as a concept is gaining significant popularity in Digital Humanities, existing LLOD standards and vocabularies are not widely used in this community, and philological resources are underrepresented in the LLOD cloud diagram (http://linguistic-lod.org/llod-cloud). In this paper, we present an application of Linguistic Linked Open Data in Assyriology. We describe the LLOD edition of a linguistically annotated corpus of Sumerian, as well as its linking with lexical resources, repositories of annotation terminology, and the museum collections in which the artifacts bearing these texts are kept. The chosen corpus is the Electronic Text Corpus of Sumerian Royal Inscriptions, a well curated and linguistically annotated archive of Sumerian text, in preparation for the creating and linking of other corpora of cuneiform texts, such as the corpus of Ur III administrative and legal Sumerian texts, as part of the Machine Translation and Automated Analysis of Cuneiform Languages project (https://cdli-gh.github.io/mtaac/). © LREC 2018 - 11th International Conference on Language Resources and Evaluation. All rights reserved.",Final,,
Wang C.; Fan Y.; He X.; Zhou A.,Predicting hypernym–hyponym relations for Chinese taxonomy learning,1,,1,#use,2019,https://www.scopus.com/inward/record.uri?eid=2-s2.0-85041836685&doi=10.1007%2fs10115-018-1166-1&partnerID=40&md5=372d88ca7d561d032b7c75d1df98b1a5,"Hypernym–hyponym (“is-a”) relations are key components in taxonomies, object hierarchies and knowledge graphs. Robustly harvesting of such relations requires the analysis of the linguistic characteristics of is-a word pairs in the target language. While there is abundant research on is-a relation extraction in English, it still remains a challenge to accurately identify such relations from Chinese knowledge sources due to the flexibility of language expression and the significant differences between the two language families. In this paper, we introduce a weakly supervised framework to extract Chinese is-a relations from user-generated categories. It employs piecewise linear projection models trained on an existing Chinese taxonomy built from Wikipedia and an iterative learning algorithm to update model parameters incrementally. A pattern-based relation selection method is proposed to prevent “semantic drift” in the learning process using bi-criteria optimization. Experimental results on the publicly available test set illustrate that the proposed approach outperforms state-of-the-art methods. © 2018, Springer-Verlag London Ltd., part of Springer Nature.",Final,,
Simov K.; Osenova P.,Special thematic section on semantic models for natural language processing,1,,1,#use,2018,https://www.scopus.com/inward/record.uri?eid=2-s2.0-85044005006&doi=10.2478%2fcait-2018-0008&partnerID=40&md5=96a18a0b072e4fb358c5aaff3fb263de,"With the availability of large language data online, cross-linked lexical resources (such as BabelNet, Predicate Matrix and UBY) and semantically annotated corpora (SemCor, OntoNotes, etc.), more and more applications in Natural Language Processing (NLP) have started to exploit various semantic models. The semantic models have been created on the base of LSA, clustering, word embeddings, deep learning, neural networks, etc., and abstract logical forms, such as Minimal Recursion Semantics (MRS) or Abstract Meaning Representation (AMR), etc. Additionally, the Linguistic Linked Open Data Cloud has been initiated (LLOD Cloud) which interlinks linguistic data for improving the tasks of NLP. This cloud has been expanding enormously for the last four-five years. It includes corpora, lexicons, thesauri, knowledge bases of various kinds, organized around appropriate ontologies, such as LEMON. The semantic models behind the data organization as well as the representation of the semantic resources themselves are a challenge to the NLP community. The NLP applications that extensively rely on the above discussed models include Machine Translation, Information Extraction, Question Answering, Text Simplification, etc. © 2001-2018 Institute of Information and Communication Technologies at Bulgarian Academy of Sciences.",Final,All Open Access; Gold Open Access,
Rouces J.; De Melo G.; Hose K.,FrameBase: Enabling integration of heterogeneous knowledge,1,,1,#use,2017,https://www.scopus.com/inward/record.uri?eid=2-s2.0-85027393990&doi=10.3233%2fSW-170279&partnerID=40&md5=9ac1b3786a699d788b9981f53c067da2,"Large-scale knowledge graphs such as those in the Linked Open Data cloud are typically stored as subject-predicate-object triples. However, many facts about the world involve more than two entities. While n-ary relations can be converted to triples in a number of ways, unfortunately, the structurally different choices made in different knowledge sources significantly impede our ability to connect them. They also increase semantic heterogeneity, making it impossible to query the data concisely and without prior knowledge of each individual source. This article presents FrameBase, a wide-coverage knowledge base schema that uses linguistic frames to represent and query n-ary relations from other knowledge bases, providing multiple levels of granularity connected via logical entailment. Overall, this provides a means for semantic integration from heterogeneous sources under a single schema and opens up possibilities to draw on natural language processing techniques for querying and data mining. © 2017 - IOS Press and the authors. All rights reserved.",Final,All Open Access; Green Open Access,
Chiarcos C.; Ionov M.; Rind-Pawlowski M.; Fäth C.; Schreur J.W.; Nevskaya I.,LLODifying linguistic glosses,1,,1,#use,2017,https://www.scopus.com/inward/record.uri?eid=2-s2.0-85021193597&doi=10.1007%2f978-3-319-59888-8_7&partnerID=40&md5=ef597d9ae10042b6d31316b2cdcc00b1,"Interlinear glossed text (IGT) is a notation used in various fields of linguistics to provide readers with a way to understand the linguistic phenomena. We describe the representation of IGT data in RDF, the conversion from two popular tools, and their automated linking with resources from the Linguistic Linked Open Data (LLOD) cloud. We argue that such an LLOD edition of IGT data facilitates their reusability, their infrastructural support and their integration with external data sources. Our converters are available under an open source license, two data sets will be published along with the final version of this paper. To our best knowledge, this is the first attempt to publish IGT data sets as Linguistic Linked Open Data we are aware of. © Springer International Publishing AG 2017.",Final,,
List J.-M.; Cysouw M.; Forkel R.,Concepticon: A resource for the linking of concept lists,1,,1,#use,2016,https://www.scopus.com/inward/record.uri?eid=2-s2.0-85037152460&partnerID=40&md5=3122a0ba89f81396469e2cb366878186,"We present an attempt to link the large amount of different concept lists which are used in the linguistic literature, ranging from Swadesh lists in historical linguistics to naming tests in clinical studies and psycholinguistics. This resource, our Concepticon, links 30 222 concept labels from 160 conceptlists to 2495 concept sets. Each concept set is given a unique identifier, a unique label, and a human-readable definition. Concept sets are further structured by defining different relations between the concepts. The resource can be used for various purposes. Serving as a rich reference for new and existing databases in diachronic and synchronic linguistics, it allows researchers a quick access to studies on semantic change, cross-linguistic polysemies, and semantic associations.",Final,,
Bennacer N.; Vioulès M.J.; López M.A.; Quercini G.,A multilingual approach to discover cross-language links in wikipedia,1,,1,#use,2015,https://www.scopus.com/inward/record.uri?eid=2-s2.0-84949963735&doi=10.1007%2f978-3-319-26190-4_36&partnerID=40&md5=c82c2a83d3eec7745f518d9a128b6b1e,"Wikipedia is a well-known public and collaborative encyclopaedia consisting of millions of articles. Initially in English, the popular website has grown to include versions in over 288 languages. These versions and their articles are interconnected via cross-language links, which not only facilitate navigation and understanding of concepts in multiple languages, but have been used in natural language processing applications, developments in linked open data, and expansion of minor Wikipedia language versions. These applications are the motivation for an automatic, robust, and accurate technique to identify cross-language links. In this paper, we present a multilingual approach called EurekaCL to automatically identify missing cross-language links in Wikipedia. More precisely, given a Wikipedia article (the source) EurekaCL uses the multilingual and semantic features of BabelNet 2.0 in order to efficiently identify a set of candidate articles in a target language that are likely to cover the same topic as the source. The Wikipedia graph structure is then exploited both to prune and to rank the candidates. Our evaluation carried out on 42,000 pairs of articles in eight language versions of Wikipedia shows that our candidate selection and pruning procedures allow an effective selection of candidates which significantly helps the determination of the correct article in the target language version. © Springer International Publishing Switzerland 2015.",Final,All Open Access; Green Open Access,
Elbedweihy K.; Wrigley S.N.; Ciravegna F.; Zhang Z.,Using BabelNet in bridging the gap between natural language queries and linked data concepts,1,,1,#WSD #use,2013,https://www.scopus.com/inward/record.uri?eid=2-s2.0-84924389956&partnerID=40&md5=8100a50afb90f17b4fc3b428021f8274,"Many semantic search tool evaluations have reported a user preference for free natural language as a query input approach as opposed to controlled or view-based inputs. Although the exibility offered by this approach is a significant advantage, it can also be a major difficulty. Allowing users complete freedom in the choice of terms increases the difficulty for the search tools to match terms with the underlying data. This causes either a mismatch which affects precision, or a missing match which affects recall. In this paper, we present an empirical investigation on the use of named entity recognition, word sense disambiguation, and ontology-based heuristics in an approach attempting to bridge this gap between user terms and ontology concepts, properties and entities. We use the dataset provided by the Question Answering over Linked Data (QALD-2) workshop in our analysis and tests.",Final,,
Sànchez-Rada J.F.; Iglesias C.A.,Onyx: Describing emotions on the web of data,1,,1,#use #sentiment anlysis,2013,https://www.scopus.com/inward/record.uri?eid=2-s2.0-84921891280&partnerID=40&md5=27c09a1447f4dd117e1549445a220b66,"Textual emotion analysis is a new field whose aim is to detect emotions in user generated content. It complements Sentiment Analysis in the characterization of users subjective opinions and feelings. Nevertheless, there is a lack of available lexical and semantic emotion resources that could foster the development of emotion analysis services. Some of the barriers for developing such resources are the diversity of emotion theories and the absence of a vocabulary to express emotion characteristics. This article presents a semantic vocabulary, called Onyx, intended to provide support to represent emotion characteristics in lexical resources and emotion analysis services. Onyx follows the Linked Data principles as it is aligned with the Provenance Ontology. It also takes a linguistic Linked Data approach: it is aligned with the Provenance Ontology, it represents lexical resources as linked data, and has been integrated with Lemon, an increasingly popular RDF model for representing lexical entries. Furthermore, it does not prescribe any emotion model and can be linked to heterogeneous emotion models expressed as Linked Data. Onyx representations can also be published using W3C EmotionML markup, based on the proposed mapping.",Final,,
Aggarwal N.; Polajnar T.; Buitelaar P.,Cross-lingual natural language querying over the web of data,1,,1,#use,2013,https://www.scopus.com/inward/record.uri?eid=2-s2.0-84884972019&doi=10.1007%2f978-3-642-38824-8_13&partnerID=40&md5=d9a6a71b02be64505ee73179c1c85e0a,"The rapid growth of the Semantic Web offers a wealth of semantic knowledge in the form of Linked Data and ontologies, which can be considered as large knowledge graphs of marked up Web data. However, much of this knowledge is only available in English, affecting effective information access in the multilingual Web. A particular challenge arises from the vocabulary gap resulting from the difference in the query and the data languages. In this paper, we present an approach to perform cross-lingual natural language queries on Linked Data. Our method includes three components: entity identification, linguistic analysis, and semantic relatedness. We use Cross-Lingual Explicit Semantic Analysis to overcome the language gap between the queries and data. The experimental results are evaluated against 50 German natural language queries. We show that an approach using a cross-lingual similarity and relatedness measure outperforms other systems that use automatic translation. We also discuss the queries that can be handled by our approach. © 2013 Springer-Verlag Berlin Heidelberg.",Final,,
Augenstein I.; Padó S.; Rudolph S.,LODifier: Generating linked data from unstructured text,,,1,#use,2012,https://www.scopus.com/inward/record.uri?eid=2-s2.0-84861720649&doi=10.1007%2f978-3-642-30284-8_21&partnerID=40&md5=97a20dcedfeacd87da0a9ac6928831df,"The automated extraction of information from text and its transformation into a formal description is an important goal in both Semantic Web research and computational linguistics. The extracted information can be used for a variety of tasks such as ontology generation, question answering and information retrieval. LODifier is an approach that combines deep semantic analysis with named entity recognition, word sense disambiguation and controlled Semantic Web vocabularies in order to extract named entities and relations between them from text and to convert them into an RDF representation which is linked to DBpedia and WordNet. We present the architecture of our tool and discuss design decisions made. An evaluation of the tool on a story link detection task gives clear evidence of its practical potential. © 2012 Springer-Verlag.",Final,All Open Access; Bronze Open Access,
Pinheiro V.; Furtado V.; Pequeno T.; Ferreira C.,Towards a common sense base in Portuguese for the linked open data cloud,1,,1,#use #kg,2012,https://www.scopus.com/inward/record.uri?eid=2-s2.0-84858427776&doi=10.1007%2f978-3-642-28885-2_15&partnerID=40&md5=44c852eeccc94e8bf61c459775b10a50,"The Linked Open Data (LOD) cloud is a promising reality since the major content producers are offering their data on an open and linked network, through RDF (Resource Description Framework), with the aim of providing Semantic Web applications with a single global database for retrieval of related content and to perform inferences over the network. However, bases with Portuguese-language content are still incipient. In this paper we present the process of inclusion of the InferenceNet - the first resource with common sense and inferentialist knowledge in Portuguese language - on the LOD. Our main goal is to leverage the use and development of Semantic Web applications by content producers in Portuguese language. We develop and evaluated a platform, called SemWidgets, for the creation and execution of widgets able to access and reason over InferenceNet and the open linked data, like DBPedia, Yago, and Article Search API of the New York Times. © 2012 Springer-Verlag.",Final,,
