Authors,Title,Pasquale,Mary,Overall,Motivation,Year,Link,Abstract,Publication Stage,Open Access,Manually added
Chen Y.-H.; Lu E.J.-L.; Lin S.-C.,Ontology-based Dynamic Semantic Annotation for Social Image Retrieval,0,0,0,#use #annotation automatic semantic image annotation model for social image retrieval,2020,https://www.scopus.com/inward/record.uri?eid=2-s2.0-85090381498&doi=10.1109%2fMDM48529.2020.00074&partnerID=40&md5=0f913291ac5297a8ef08dcb0c1851b52,"To mitigate the semantic gap between a visual feature and linguistic representation in social image retrieval, researchers have proposed an automatic image annotation approach, which employs multiple visual features and text matching to label images. This paper used a linked open data approach and ontology to construct a model, an automatic semantic image annotation model for social image retrieval. These models enable users to label images through automatic semantic annotation and to identify the underlying intents of semantics, thereby fulfilling user needs and enhancing the retrieval accuracy. © 2020 IEEE.",Final,,
Bourgonje P.; Moreno-Schneider J.; Nehring J.; Rehm G.; Sasaki F.; Srivastava A.,Towards a platform for curation technologies: Enriching text collections with a semantic-web layer,1,1,1,#use,2016,https://www.scopus.com/inward/record.uri?eid=2-s2.0-84994527341&doi=10.1007%2f978-3-319-47602-5_14&partnerID=40&md5=bd87b516c5ba0f26a86c73d8b6c06189,"In an attempt to put a Semantic Web-layer that provides linguistic analysis and discourse information on top of digital content, we develop a platform for digital curation technologies. The platform offers language-, knowledge-and data-aware services as a flexible set of workflows and pipelines for the efficient processing of various types of digital content. The platform is intended to enable human experts (knowledge workers) to get a grasp and understand the contents of large document collections in an efficient way so that they can curate, process and further analyse the collection according to their sector-specific needs. © Springer International Publishing AG 2016.",Final,,
Xing C.; Liu X.; Du D.; Hu W.; Zhang M.,Relation extraction using language model based on knowledge graph,-1,-1,-1,#use,2020,https://www.scopus.com/inward/record.uri?eid=2-s2.0-85096414931&doi=10.1088%2f1742-6596%2f1624%2f2%2f022037&partnerID=40&md5=8dabd909fb79c05a8f685bdafcfba007,"Relation extraction is an important task in natural language processing (NLP). The existing methods generally pay more attention on extracting textual semantic information from text, but ignore the relation contextual information from existed relations in datasets, which is very important for the performance of relation extraction task. In this paper, we represent each individual entity as a embedding based on entities and relations knowledge graph, which encodes the relation contextual information between the given entity pairs and relations. Besides, inspired by the impressive performance of language models recently, we used the language model to leverage word semantic information, in which word semantic information can be better captured than word embedding. The experimental results on SemEval2010 Task 8 dataset showed that the F1-score of our proposed method improved nearly 3% compared with the previous methods. © 2020 Institute of Physics Publishing. All rights reserved.",Final,All Open Access; Bronze Open Access,
Kumar S.; Ramaneswaran S.; Akhtar M.S.; Chakraborty T.,From Multilingual Complexity to Emotional Clarity: Leveraging Commonsense to Unveil Emotions in Code-Mixed Dialogues,1,1,1,#use #commonsensekg,2023,https://www.scopus.com/inward/record.uri?eid=2-s2.0-85184822341&partnerID=40&md5=14584b69691f8ab92b34cc16279846d8,"Understanding emotions during conversation is a fundamental aspect of human communication, driving NLP research for Emotion Recognition in Conversation (ERC). While considerable research has focused on discerning emotions of individual speakers in monolingual dialogues, understanding the emotional dynamics in code-mixed conversations has received relatively less attention. This motivates our undertaking of ERC for code-mixed conversations in this study. Recognizing that emotional intelligence encompasses a comprehension of worldly knowledge, we propose an innovative approach that integrates commonsense information with dialogue context to facilitate a deeper understanding of emotions. To achieve this, we devise an efficient pipeline that extracts relevant commonsense from existing knowledge graphs based on the code-mixed input. Subsequently, we develop an advanced fusion technique that seamlessly combines the acquired commonsense information with the dialogue representation obtained from a dedicated dialogue understanding module. Our comprehensive experimentation showcases the substantial performance improvement obtained through the systematic incorporation of commonsense in ERC. Both quantitative assessments and qualitative analyses further corroborate the validity of our hypothesis, reaffirming the pivotal role of commonsense integration in enhancing ERC. © 2023 Association for Computational Linguistics.",Final,,
Zhao Y.; Zhang J.; Zhou Y.; Zong C.,Knowledge graphs enhanced neural machine translation,1,1,1,#use #translation,2020,https://www.scopus.com/inward/record.uri?eid=2-s2.0-85097342403&partnerID=40&md5=0ae6d87f08dd49ee81d8742071255ca0,"Knowledge graphs (KGs) store much structured information on various entities, many of which are not covered by the parallel sentence pairs of neural machine translation (NMT). To improve the translation quality of these entities, in this paper we propose a novel KGs enhanced NMT method. Specifically, we first induce the new translation results of these entities by transforming the source and target KGs into a unified semantic space. We then generate adequate pseudo parallel sentence pairs that contain these induced entity pairs. Finally, NMT model is jointly trained by the original and pseudo sentence pairs. The extensive experiments on Chinese-to-English and English-to-Japanese translation tasks demonstrate that our method significantly outperforms the strong baseline models in translation quality, especially in handling the induced entities. © 2020 Inst. Sci. inf., Univ. Defence in Belgrade. All rights reserved.",Final,,
Chen X.; Chen M.; Fan C.; Uppunda A.; Sun Y.; Zaniolo C.,Multilingual knowledge graph completion via ensemble knowledge transfer,1,1,1,#use #kgcompletion,2020,https://www.scopus.com/inward/record.uri?eid=2-s2.0-85098414071&partnerID=40&md5=16c05b1bd715d103286c9b4c277dc12a,"Predicting missing facts in a knowledge graph (KG) is a crucial task in knowledge base construction and reasoning; and it has been the subject of much research in recent works using KG embeddings. While existing KG embedding approaches mainly learn and predict facts within a single KG, a more plausible solution would benefit from the knowledge in multiple language-specific KGs, considering that different KGs have their own strengths and limitations on data quality and coverage. This is quite challenging, since the transfer of knowledge among multiple independently maintained KGs is often hindered by the insufficiency of alignment information and the inconsistency of described facts. In this paper, we propose KEnS, a novel framework for embedding learning and ensemble knowledge transfer across a number of language-specific KGs. KEnS embeds all KGs in a shared embedding space, where the association of entities is captured based on self-learning. Then, KEnS performs ensemble inference to combine prediction results from embeddings of multiple language-specific KGs, for which multiple ensemble techniques are investigated. Experiments on five real-world language-specific KGs show that KEnS consistently improves state-of-the-art methods on KG completion, via effectively identifying and leveraging complementary knowledge. © 2020 Association for Computational Linguistics",Final,,
Tan Y.; Zhang X.; Chen Y.; Ali Z.; Hua Y.; Qi G.,CLRN: A reasoning network for multi-relation question answering over Cross-lingual Knowledge Graphs,1,1,1,#use #cross-lingualkgs #questionanswering,2023,https://www.scopus.com/inward/record.uri?eid=2-s2.0-85162144389&doi=10.1016%2fj.eswa.2023.120721&partnerID=40&md5=725cd1d23f8e203ad0f1238fbe3f76a0,"Cross-lingual Knowledge Graphs-based Question Answering (CLKGQA) requires the question answering (QA) system to combine the knowledge graphs (KGs) in different languages to obtain answers to input questions. In previous works, the common idea is to merge Cross-lingual Knowledge Graphs (CLKGs) into a single KG through aligned entity pairs and then treat it as a traditional KG-based QA. However, as demonstrated by Tan et al. (2023), existing Entity Alignment (EA) models cannot generate highly accurate aligned entity pairs for CLKGs. Therefore, two issues need to be addressed in the CLKGQA task: (1) Remove the dependency of the QA model on the fused KG; (2) Improve the performance of the EA model in obtaining aligned entity pairs from locally isomorphic CLKGs. To solve the above two issues, this paper presents Cross-lingual Reasoning Network (CLRN), a novel multi-hop QA model that allows switching knowledge graphs at any stage of the multi-hop reasoning. Furthermore, we establish an iterative framework that combines CLRN and EA model, in which CLRN is used for extracting potential alignment triple pairs from CLKGs during the QA process. The extracted triple pairs provide pseudo-aligned entities, and the additional aligned entity pairs are used to mine missing relations between entities in CLKGs. These pseudo-aligned entity pairs and relations improve the performance of the EA model, resulting in higher accuracy in QA. Extensive experiments demonstrate the effectiveness of the proposed model, which outperforms the baseline approaches. Through iterative enhancement, the performance of the EA model has also been improved by > 1.0 % in Hit@1 and Hit@10, and the improvement is statistically significant in the confidence interval of p<0.01. Moreover, our work discusses the correlation between QA and EA from the side of QA, which has reference value for the follow-up exploration of related communities. We have open-sourced our dataset and code, which is available at the URL https://github.com/tan92hl/Cross-lingual-Reasoning-Network-for-CLKGQA. © 2023 Elsevier Ltd",Final,,
Goel S.; Gracia J.; Forcada M.L.,Bilingual dictionary generation and enrichment via graph exploration,1,1,1,#kg apertium #use #synonyms,2022,https://www.scopus.com/inward/record.uri?eid=2-s2.0-85140834359&doi=10.3233%2fSW-222899&partnerID=40&md5=dacaa9f99e46d8a0814518971cac32c2,"In recent years, we have witnessed a steady growth of linguistic information represented and exposed as linked data on the Web. Such linguistic linked data have stimulated the development and use of openly available linguistic knowledge graphs, as is the case with the Apertium RDF, a collection of interconnected bilingual dictionaries represented and accessible through Semantic Web standards. In this work, we explore techniques that exploit the graph nature of bilingual dictionaries to automatically infer new links (translations). We build upon a cycle density based method: partitioning the graph into biconnected components for a speed-up, and simplifying the pipeline through a careful structural analysis that reduces hyperparameter tuning requirements. We also analyse the shortcomings of traditional evaluation metrics used for translation inference and propose to complement them with new ones, both-word precision (BWP) and both-word recall (BWR), aimed at being more informative of algorithmic improvements. Over twenty-seven language pairs, our algorithm produces dictionaries about 70% the size of existing Apertium RDF dictionaries at a high BWP of 85% from scratch within a minute. Human evaluation shows that 78% of the additional translations generated for dictionary enrichment are correct as well. We further describe an interesting use-case: inferring synonyms within a single language, on which our initial human-based evaluation shows an average accuracy of 84%. We release our tool as free/open-source software which can not only be applied to RDF data and Apertium dictionaries, but is also easily usable for other formats and communities. © 2022 - The authors. Published by IOS Press.",Final,All Open Access; Bronze Open Access; Green Open Access,
Liu L.; Li X.; He R.; Bing L.; Joty S.; Si L.,Enhancing Multilingual Language Model with Massive Multilingual Knowledge Triples,1,1,1,#use,2022,https://www.scopus.com/inward/record.uri?eid=2-s2.0-85143087240&partnerID=40&md5=23c56bd34f15c1847bdc19f5bba9c742,"Knowledge-enhanced language representation learning has shown promising results across various knowledge-intensive NLP tasks. However, prior methods are limited in efficient utilization of multilingual knowledge graph (KG) data for language model (LM) pretraining. They often train LMs with KGs in indirect ways, relying on extra entity/relation embeddings to facilitate knowledge injection. In this work, we explore methods to make better use of the multilingual annotation and language agnostic property of KG triples, and present novel knowledge based multilingual language models (KMLMs) trained directly on the knowledge triples. We first generate a large amount of multilingual synthetic sentences using the Wikidata KG triples. Then based on the intra- and inter-sentence structures of the generated data, we design pretraining tasks to enable the LMs to not only memorize the factual knowledge but also learn useful logical patterns. Our pretrained KMLMs demonstrate significant performance improvements on a wide range of knowledge-intensive crosslingual tasks, including named entity recognition (NER), factual knowledge retrieval, relation classification, and a newly designed logical reasoning task. © 2022 Association for Computational Linguistics.",Final,,
Zhou Y.; Geng X.; Shen T.; Zhang W.; Jiang D.,Improving Zero-Shot Cross-lingual Transfer for Multilingual Question Answering over Knowledge Graph,1,1,1,#use #question-anserwing,2021,https://www.scopus.com/inward/record.uri?eid=2-s2.0-85113823264&partnerID=40&md5=927041cb034315cb207fa63a6422b3d5,"Multilingual question answering over knowledge graph (KGQA) aims to derive answers from a knowledge graph (KG) for questions in multiple languages. To be widely applicable, we focus on its zero-shot transfer setting. That is, we can only access training data in a high-resource language, while need to answer multilingual questions without any labeled data in target languages. A straightforward approach is resorting to pre-trained multilingual models (e.g., mBERT) for cross-lingual transfer, but there is a still significant gap of KGQA performance between source and target languages. In this paper, we exploit unsupervised bilingual lexicon induction (BLI) to map training questions in source language into those in target language as augmented training data, which circumvents language inconsistency between training and inference. Furthermore, we propose an adversarial learning strategy to alleviate syntax-disorder of the augmented data, making the model incline to both language- and syntax-independence. Consequently, our model narrows the gap in zero-shot cross-lingual transfer. Experiments on two multilingual KGQA datasets with 11 zero-resource languages verify its effectiveness. © 2021 Association for Computational Linguistics.",Final,,
Recupero D.R.; Consoli S.; Gangemi A.; Nuzzolese A.G.; Presutti V.; Spampinato D.,Semantic web-based sentiment analysis,1,1,1,#use sentiment analysis,2014,https://www.scopus.com/inward/record.uri?eid=2-s2.0-84926391179&partnerID=40&md5=2348848a14158c7f8c3ec2bdd1146d5a,"The introduction of semantics in Sentiment Analysis research has proved to bring several benefits for what performances are concerned and has allowed to identify new challenging tasks to be accomplished. Semantics helps structuring the plain natural language text with formal representation. The current system we are developing performs sentiment analysis by hybridizing natural language processing techniques with Semantic Web technologies. Our system, called Sentilo, is able to recognize the holder of an opinion, to detect the topics and sub-topics in its scope, and to measure the sentiment expressed by them. This information is formally represented by means of RDF graphs according to an OWL opinion ontology, while holders and topics identity is resolved on the Linked Open Data cloud.",Final,,
Calì A.; Capuzzi S.; Dimartino M.M.; Frosini R.,Recommendation of text tags in social applications using linked data,-1,1,1,#use #sematic-similarity,2013,https://www.scopus.com/inward/record.uri?eid=2-s2.0-84893742773&doi=10.1007%2f978-3-319-04244-2_17&partnerID=40&md5=45ad37b0010cf876305de854d418aa6f,We present a recommender system that suggests geo-located text tags by using linguistic information extracted from Linked Data sets available on the Web. The recommender system performs tag matching by measuring the semantic similarity of natural language texts. Our approach evaluates similarity using a technique that compares sentences taking into account their grammatical structure. © Springer International Publishing 2013.,Final,All Open Access; Bronze Open Access,
Guo M.; Chen Y.; Xu J.; Zhang Y.,Dynamic Knowledge Integration for Natural Language Inference,-1,1,1,#use,2022,https://www.scopus.com/inward/record.uri?eid=2-s2.0-85139414930&doi=10.1109%2fICNLP55136.2022.00066&partnerID=40&md5=0bedbd55d6413eaf9aaa331f6cc6d90c,"Natural language inference (NLI) aims to determine the entailment relationship between the premise and the hypothesis. It is a fundamental but difficult problem, since there may exists serious semantic and logistic gap between the premise and the hypothesis. Despite using strong pre-trained language model (PLM), previous work performs poorly on complicated reasoning for knowledge-sensitive cases ignoring the integration of external knowledge. We propose a dynamic knowledge integration strategy for NLI, where knowledge from multiple knowledge graphs (KGs) can be dynamically integrated. For each KG, it transforms input tokens into a graph according to the connectivity of the related entities. All the graphs are encoded by a group of parallel graph neural networks (GNNs), and after each layer the intermediate results are integrated dynamically by being conditioned on the input text. This strategy also facilitates the incorporation of PLM, simply by treating the input tokens as a fully connected graph and adapting the PLM outputs as the node embeddings. Experiments on SNLI, MNLI and SciTail show that, the dynamic integration of knowledge from WordNet and ConceptNet achieves significant improvements over the strongest baseline built upon RoBERTa. © 2022 IEEE.",Final,,
Pan Y.; Chen Q.; Peng W.; Wang X.; Hu B.; Liu X.; Chen J.; Zhou W.,MedWriter: Knowledge-Aware Medical Text Generation,-1,1,1,#use,2020,https://www.scopus.com/inward/record.uri?eid=2-s2.0-85139892424&partnerID=40&md5=e3ce78079138dbef5b8f502fc13e0dea,"To exploit the domain knowledge to guarantee the correctness of generated text has been a hot topic in recent years, especially for high professional domains such as medical. However, most of recent works only consider the information of unstructured text rather than structured information of the knowledge graph. In this paper, we focus on the medical topic-to-text generation task and adapt a knowledge-aware text generation model to the medical domain, named MedWriter, which not only introduces the specific knowledge from the external MKG but also is capable of learning graph-level representation. We conduct experiments on a medical literature dataset collected from medical journals, each of which has a set of topic words, an abstract of medical literature and a corresponding knowledge graph from CMeKG. Experimental results demonstrate incorporating knowledge graph into generation model can improve the quality of the generated text and has robust superiority over the competitor methods. © 2020 COLING 2020 - 28th International Conference on Computational Linguistics, Proceedings of the Conference. All rights reserved.",Final,,
Kumar S.; Jat S.; Saxena K.; Talukdar P.,Zero-shot word sense disambiguation using sense definition embeddings,-1,1,1,#use #word-sense_disambiguation WordNet,2020,https://www.scopus.com/inward/record.uri?eid=2-s2.0-85075859601&partnerID=40&md5=df7fa442077c5b74e0de03860cb4219b,"Word Sense Disambiguation (WSD) is a longstanding but open problem in Natural Language Processing (NLP). WSD corpora are typically small in size, owing to an expensive annotation process. Current supervised WSD methods treat senses as discrete labels and also resort to predicting the Most-Frequent-Sense (MFS) for words unseen during training. This leads to poor performance on rare and unseen senses. To overcome this challenge, we propose Extended WSD Incorporating Sense Embeddings (EWISE), a supervised model to perform WSD by predicting over a continuous sense embedding space as opposed to a discrete label space. This allows EWISE to generalize over both seen and unseen senses, thus achieving generalized zero-shot learning. To obtain target sense embeddings, EWISE utilizes sense definitions. EWISE learns a novel sentence encoder for sense definitions by using WordNet relations and also ConvE, a recently proposed knowledge graph embedding method. We also compare EWISE against other sentence encoders pretrained on large corpora to generate definition embeddings. EWISE achieves new state-of-the-art WSD performance. © 2019 Association for Computational Linguistics",Final,,
Li H.; Xu F.,Question answering with DBpedia based on the dependency parser and entity-centric index,,1,1,#use #question-answering WordNet and conceptnet to expand synonyms,2016,https://www.scopus.com/inward/record.uri?eid=2-s2.0-84994850866&doi=10.1109%2fICCIA.2016.10&partnerID=40&md5=d27f5e4648b945d672480870bf24972f,"The emerging Linked Open Data provides an opportunity to answer the natural language question based on knowledge bases (KB). This study proposes an approach to question answering (QA) on the DBpedia dataset. After parsing the question by a dependency parser, we locate the entity mention and property mention with predefined templates. We propose an entity-centric indexing model to help search referent entities in KB. After obtaining the referent entities, we expand the property mention with WordNet and ConceptNet to find the referent properties of the returned entities. The values of the referent property are then considered the answer to the question. Evaluations are performed on DBpedia version 2015. Results show that our approach reaches 46% precision when the top-10 entities are returned in the final QA stage. The evaluation tests show that our approach is promising in dealing with QA in Linked Data. © 2016 IEEE.",Final,,
Van Aggelen A.; Hollink L.; Van Ossenbruggen J.,Combining distributional semantics and structured data to study lexical change,1,1,1,#use,2016,https://www.scopus.com/inward/record.uri?eid=2-s2.0-85016291410&partnerID=40&md5=c553b8279d1c93ff2cff33aba3370daa,"Statistical Natural Language Processing (NLP) techniques allow to quantify lexical semantic change using large text corpora. Word-level results of these methods can be hard to analyse in the context of sets of semantically or linguistically related words. On the other hand, structured knowledge sources represent such relationships explicitly, but ignore the problem of semantic change. We aim to address these limitations by combining the statistical and symbolic approach: we enrich WordNet, a structured lexical database, with quantitative lexical change scores provided by HistWords, a dataset produced by distributional NLP methods. We publish the result as Linked Open Data and demonstrate how queries on the combined dataset can provide new insights. © 2016, CEUR-WS. All rights reserved.",Final,,
Srivastava N.; Perevalov A.; Kuchelev D.; Moussallem D.; Ngonga Ngomo A.-C.; Both A.,Lingua Franca - Entity-Aware Machine Translation Approach for Question Answering over Knowledge Graphs,1,1,1,#use,2023,https://www.scopus.com/inward/record.uri?eid=2-s2.0-85180369135&doi=10.1145%2f3587259.3627567&partnerID=40&md5=65a582eb42da55e0bc56ce9e187cbe41,"This research paper proposes an approach called Lingua Franca that improves machine translation quality by utilizing information from a knowledge graph to translate named entities accurately. The accurate entity translation is crucial when applied to entity-oriented search including Knowledge Graph Question Answering systems. In a nutshell, the approach preserves recognized named entities with an entity-replacement technique during the translation process. It replaces the entities back with their labels found in a knowledge graph for the target language to ensure that questions are translated correctly before answering them using a Knowledge Graph Question Answering system. The paper also introduces an open-source modular framework that enables researchers to design their own named entity-aware machine translation pipelines. The presented experimental results demonstrate the effectiveness of the Lingua Franca approach in comparison to baseline Machine Translation models. The approach shows a statistically significant improvement in the quality provided by several Knowledge Graph Question Answering systems using Lingua Franca on different datasets. © 2023 ACM.",Final,,
