Authors,Title,Pasquale,Mary,Overall,Motivation,Year,Link,Abstract,Publication Stage,Open Access,Manually added
AlMousa M.; Benlamri R.; Khoury R.,A novel word sense disambiguation approach using WordNet knowledge graph,1,1,1,#use #wordsensedisambiguation,2022,https://www.scopus.com/inward/record.uri?eid=2-s2.0-85122705398&doi=10.1016%2fj.csl.2021.101337&partnerID=40&md5=ac2d90607397c902c5eaef4ae5251b0c,"Various applications in computational linguistics and artificial intelligence rely on high-performing word sense disambiguation techniques to solve challenging tasks such as information retrieval, machine translation, question answering, and document clustering. While text comprehension is intuitive for humans, machines face tremendous challenges in processing and interpreting a human's natural language. This paper presents a novel knowledge-based word sense disambiguation algorithm, namely Sequential Contextual Similarity Matrix Multiplication (SCSMM). The SCSMM algorithm combines semantic similarity, heuristic knowledge, and document context to respectively exploit the merits of local sense-based context between consecutive terms, human knowledge about terms, and a document's main topic in disambiguating terms. Unlike other algorithms, the SCSMM algorithm guarantees the capture of the maximum sentence context while maintaining the terms’ order within the sentence. The proposed algorithm outperformed all other algorithms when disambiguating nouns on the combined gold standard datasets, while demonstrating comparable results to current state-of-the-art word sense disambiguation systems when dealing with each dataset separately. Furthermore, the paper discusses the impact of granularity level, ambiguity rate, sentence size, and part of speech distribution on the performance of the proposed algorithm. © 2022 Elsevier Ltd",Final,All Open Access; Green Open Access,
Pedretti I.; Del Grosso A.; Giovannetti E.; Mancini L.; Piccini S.; Abrate M.; Lo Duca A.; Marchetti A.,"The clavius on the web project: Digitization, annotation and visualization of early modern manuscripts",1,1,1,#use,2015,https://www.scopus.com/inward/record.uri?eid=2-s2.0-84958691991&doi=10.1145%2f2802612.2802636&partnerID=40&md5=62dee99529fbb39587a182d59688ec41,"This paper describes the full procedure adopted in the context of the Clavius on the Web project, which aims to help Web users to appraise the importance of specific manuscripts by going beyond their digital reproduction. The proposed approach is based on the multilayered explication of linguistic, lexical and semantic data representing the innermost nature of the analyzed manuscripts. The final purpose of the project is to gather and display the results of the three layers of analysis through interactive visualization techniques and export them as Linked Data. All the analyses rely on the XML/TEI encoding of the text, followed by a CTS-based tokenization. As a working example for this paper, the analysis of a portion of a manuscript provided by Historical Archives of the Pontifical Gregorian University will be illustrated. The text is a letter written in Latin and sent by Botvitus Nericius to Christophorus Clavius in 1598 from Madrid. © 2014 ACM.",Final,,
Li Y.; Clark P.,Answering elementary science questions by constructing coherent scenes using background knowledge,1,1,1,#use,2015,https://www.scopus.com/inward/record.uri?eid=2-s2.0-84959867303&doi=10.18653%2fv1%2fd15-1236&partnerID=40&md5=ca35d2968fd72770c7eabd9c013c4b46,"Much of what we understand from text is not explicitly stated. Rather, the reader uses his/her knowledge to fill in gaps and create a coherent, mental picture or ""scene"" depicting what text appears to convey. The scene constitutes an understanding of the text, and can be used to answer questions that go beyond the text. Our goal is to answer elementary science questions, where this requirement is pervasive; A question will often give a partial description of a scene and ask the student about implicit information. We show that by using a simple ""knowledge graph"" representation of the question, we can leverage several large-scale linguistic resources to provide missing background knowledge, somewhat alleviating the knowledge bottleneck in previous approaches. The coherence of the best resulting scene, built from a question/answer-candidate pair, reflects the confidence that the answer candidate is correct, and thus can be used to answer multiple choice questions. Our experiments show that this approach outperforms competitive algorithms on several datasets tested. The significance of this work is thus to show that a simple ""knowledge graph"" representation allows a version of ""interpretation as scene construction"" to be made viable. © 2015 Association for Computational Linguistics.",Final,All Open Access; Green Open Access; Hybrid Gold Open Access,
Wendt M.; Gerlach M.; Düwiger H.,Linguistic modeling of linked open data for question answering,1,1,1,#use,2015,https://www.scopus.com/inward/record.uri?eid=2-s2.0-84942694222&doi=10.1007%2f978-3-662-46641-4_8&partnerID=40&md5=5d225bae902853fe2896daa11926a55a,"With the evolution of linked open data sources, question answering regains importance as a way to make data accessible and explorable to the public. The triple structure of RDF-data at the same time seems to predetermine question answering for being devised in its native subject-verb-object form. The devices of natural language, however, often exceed this trFiple-centered model. But RDF does not preclude this point of view. Rather, it depends on the modeling. As part of a government funded research project named Alexandria, we implemented an approach to question answering that enables the user to ask questions in ways that may involve more than binary relations. © Springer-Verlag Berlin Heidelberg 2015.",Final,All Open Access; Green Open Access,
Franco-Salvador M.; Gupta P.; Rosso P.,Knowledge graphs as context models: Improving the detection of cross-language plagiarism with paraphrasing,1,1,1,#use #plagiarism-detection,2014,https://www.scopus.com/inward/record.uri?eid=2-s2.0-84901341490&doi=10.1007%2f978-3-642-54798-0_12&partnerID=40&md5=38f36f4e100941b64bcdc632b5e709fd,"Cross-language plagiarism detection attempts to identify and extract automatically plagiarism among documents in different languages. Plagiarized fragments can be translated verbatim copies or may alter their structure to hide the copying, which is known as paraphrasing and is more difficult to detect. In order to improve the paraphrasing detection, we use a knowledge graph-based approach to obtain and compare context models of document fragments in different languages. Experimental results in German-English and Spanish-English cross-language plagiarism detection indicate that our knowledge graph-based approach offers a better performance compared to other state-of-the-art models. © 2014 Springer-Verlag.",Final,All Open Access; Green Open Access,
Li X.; Tur G.; Hakkani-Tur D.; Li Q.,Personal knowledge graph population from user utterances in conversational understanding,1,1,1,#use,2014,https://www.scopus.com/inward/record.uri?eid=2-s2.0-84983195590&doi=10.1109%2fSLT.2014.7078578&partnerID=40&md5=1cdb2929b884ab85366b7f988ad9290f,"Knowledge graphs provide a powerful representation of entities and the relationships between them, but automatically constructing such graphs from spoken language utterances presents the novelty and numerous challenges. In this paper, we introduce a statistical language understanding approach to automatically construct personal (user-centric) knowledge graphs in conversational dialogs. Such information has the potential to better understand the users' requests, fulfilling them, and enabling other technologies such as developing better inferences or proactive interactions. Knowledge encoded in semantic graphs such as Freebase has been shown to benefit semantic parsing and interpretation of natural language utterances. Hence, as a first step, we exploit the personal factual relation triples from Freebase to mine natural language snippets with a search engine, and the resulting snippets containing pairs of related entities to create the training data. This data is then used to build three key language understanding components: (1) Personal Assertion Classification identifies the user utterances that are relevant with personal facts, e.g., 'my mother's name is Rosa'; (2) Relation Detection classifies the personal assertion utterance into one of the predefined relation classes, e.g., 'parents'; and (3) Slot Filling labels the attributes or arguments of relations, e.g., 'name(parents): Rosa'. Our experiments using the Microsoft conversational understanding system demonstrate the performance of this proposed approach on the population of personal knowledge graphs. © 2014 IEEE.",Final,,
Zugarini A.; Röthenbacher T.; Klede K.; Ernandes M.; Eskofier B.M.; Zanca D.,Die Rätselrevolution: Automated German Crossword Solving,1,1,1,#use,2023,https://www.scopus.com/inward/record.uri?eid=2-s2.0-85181170035&partnerID=40&md5=e1a37ea17994eb346966d1a80adfd77c,"Crossword puzzles are popular word games played in various languages around the world, with diverse styles across different countries. For this reason, automated crossword solvers designed for a language, may not work well on others. In this paper, we extend Webcrow, an automatic crossword solver, to German, making it the first program for crossword solving in the German language. To address the lack of large clue-answer crossword pairs data, Webcrow combines multiple modules, known as experts, which retrieve potential answers from various resources, including the web, knowledge graphs, and linguistic rules. The system is evaluated on a collection of crosswords from variegate sources, where it is able to solve perfectly 67% of them. Additional analysis reveals that while our solver achieved commendable results, puzzles with poorly constrained schemas and original clues still presented significant hurdles. These findings shed light on the complexity of the crossword-solving problem and emphasize the need for future research to address and overcome these particular challenges effectively. © 2023 Copyright for this paper by its authors. Use permitted under Creative Commons License Attribution 4.0 International (CC BY 4.0).",Final,,
Pavithra C.P.; Mandal S.,An Overview of Relevant Literature on Different Approaches to Word Sense Disambiguation,1,1,1,#use #wordsensedisambiguation,2021,https://www.scopus.com/inward/record.uri?eid=2-s2.0-85123448034&doi=10.1109%2fICECCT52121.2021.9616677&partnerID=40&md5=362966991d677e643d37bcc41ddb99cc,"WSD (Word Sense Disambiguation) is a common issue in Natural Language Processing (NLP) and Machine Learning technology. In NLP, word sense disambiguation is described as the capacity to detect which meaning of a word is activated by its use in a specific context. WSD is a solution to the uncertainty that occurs when words have different meanings in different contexts. Contextual word meaning plays an important role in various applications such as sentiment analysis, search engine, information extraction, machine translation etc. It is a challenge for these systems to detect and overcome the uncertainty that emerges from the lexical ambiguity. Many studies have been conducted over the decades to propose various approaches to the WSD problem. In this manuscript, a comparative study of three approaches namely LESK algorithm, embedding techniques, and Neural Network techniques based on the text collected from children's story books is performed. We explored an approach that combines Bi-LSTM neural network with Knowledge Graph to predict contextual word meaning. Our study shows that the combined approach accuracy is 80.34approaches © 2021 IEEE.",Final,,
Becker M.; Korfhage K.; Frank A.,COCO-EX: A tool for linking concepts from texts to conceptnet,1,1,1,#use,2021,https://www.scopus.com/inward/record.uri?eid=2-s2.0-85107282443&partnerID=40&md5=bf9c125f24319e7264ffc336123d4791,"In this paper we present COCO-EX, a tool for Extracting Concepts from texts and linking them to the ConceptNet knowledge graph. COCO-EX extracts meaningful concepts from natural language texts and maps them to conjunct concept nodes in ConceptNet, utilizing the maximum of relational information stored in the ConceptNet knowledge graph. COCO-EX takes into account the challenging characteristics of ConceptNet, namely that - unlike conventional knowledge graphs - nodes are represented as non-canonicalized, free-form text. This means that i) concepts are not normalized; ii) they often consist of several different, nested phrase types; and iii) many of them are uninformative, over-specific, or misspelled. A commonly used shortcut to circumvent these problems is to apply string matching. We compare COCO-EX to this method and show that COCO-EX enables the extraction of meaningful, important rather than overspecific or uninformative concepts, and allows to assess more relational information stored in the knowledge graph. © 2021 Association for Computational Linguistics",Final,,
Chen M.; Shi W.; Zhou B.; Roth D.,Cross-lingual entity alignment with incidental supervision,1,1,1,#use #embeddings,2021,https://www.scopus.com/inward/record.uri?eid=2-s2.0-85106367685&partnerID=40&md5=6ce87ce9d8dab67a1d80ecba9685f668,"Much research effort has been put to multilingual knowledge graph (KG) embedding methods to address the entity alignment task, which seeks to match entities in different language-specific KGs that refer to the same real-world object. Such methods are often hindered by the insufficiency of seed alignment provided between KGs. Therefore, we propose an incidentally supervised model, JEANS, which jointly represents multilingual KGs and text corpora in a shared embedding scheme, and seeks to improve entity alignment with incidental supervision signals from text. JEANS first deploys an entity grounding process to combine each KG with the monolingual text corpus. Then, two learning processes are conducted: (i) an embedding learning process to encode the KG and text of each language in one embedding space, and (ii) a self-learning based alignment learning process to iteratively induce the matching of entities and that of lexemes between embeddings. Experiments on benchmark datasets show that JEANS leads to promising improvement on entity alignment with incidental supervision, and significantly outperforms state-of-the-art methods that solely rely on internal information of KGs. © 2021 Association for Computational Linguistics",Final,,
Zhou P.; Gopalakrishnan K.; Hedayatnia B.; Kim S.; Pujara J.; Ren X.; Liu Y.; Hakkani-Tu D.,Commonsense-Focused Dialogues for Response Generation: An Empirical Study,1,1,1,#use #commonsense,2021,https://www.scopus.com/inward/record.uri?eid=2-s2.0-85117308108&partnerID=40&md5=303ec9ab3fd4f438ba19544878e2e34c,"Smooth and effective communication requires the ability to perform latent or explicit commonsense inference. Prior commonsense reasoning benchmarks (such as SocialIQA and CommonsenseQA) mainly focus on the discriminative task of choosing the right answer from a set of candidates, and do not involve interactive language generation as in dialogue. Moreover, existing dialogue datasets do not explicitly focus on exhibiting commonsense as a facet. In this paper, we present an empirical study of commonsense in dialogue response generation. We first auto-extract commonsensical dialogues from existing dialogue datasets by leveraging ConceptNet, a commonsense knowledge graph. Furthermore, building on social contexts/situations in SocialIQA, we collect a new dialogue dataset with 25K dialogues aimed at exhibiting social commonsense in an interactive setting. We evaluate response generation models trained using these datasets and find that models trained on both extracted and our collected data produce responses that consistently exhibit more commonsense than baselines. Finally we propose an approach for automatic evaluation of commonsense that relies on features derived from ConceptNet and pretrained language and dialog models, and show reasonable correlation with human evaluation of responses' commonsense quality. ©2021 Association for Computational Linguistics.",Final,,
Bauer L.; Bansal M.,"Identify, align, and integrate: Matching knowledge graphs to commonsense reasoning tasks",1,1,1,#use #commonsense,2021,https://www.scopus.com/inward/record.uri?eid=2-s2.0-85107268857&partnerID=40&md5=1a3d30a6d333c1d466373512665e1c17,"Integrating external knowledge into commonsense reasoning tasks has shown progress in resolving some, but not all, knowledge gaps in these tasks. For knowledge integration to yield peak performance, it is critical to select a knowledge graph (KG) that is well-aligned with the given task's objective. We present an approach to assess how well a candidate KG can correctly identify and accurately fill in gaps of reasoning for a task, which we call KG-to-task match. We show this KG-to-task match in 3 phases: knowledge-task identification, knowledge-task alignment, and knowledge-task integration. We also analyze our transformer-based KG-to-task models via commonsense probes to measure how much knowledge is captured in these models before and after KG integration. Empirically, we investigate KG matches for the SocialIQA (SIQA) (Sap et al., 2019b), Physical IQA (PIQA) (Bisk et al., 2020), and MCScript2.0 (Ostermann et al., 2019) datasets with 3 diverse KGs: ATOMIC (Sap et al., 2019a), ConceptNet (Speer et al., 2017), and an automatically constructed instructional KG based on WikiHow (Koupaee and Wang, 2018). With our methods we are able to demonstrate that ATOMIC, an event-inference focused KG, is the best match for SIQA and MCScript2.0, and that the taxonomic ConceptNet and WikiHow-based KGs are the best matches for PIQA across all 3 analysis phases. We verify our methods and findings with human evaluation. © 2021 Association for Computational Linguistics",Final,,
Bouziane A.; Bouchiha D.; Doumi N.,Annotating Arabic Texts with Linked Data,1,1,1,#use #arabic,2020,https://www.scopus.com/inward/record.uri?eid=2-s2.0-85106857950&doi=10.1109%2fISIA51297.2020.9416543&partnerID=40&md5=ffe754a542a65be0b0f0ada6d5e53302,"The evolution of the traditional Web towards the semantic Web allows the machine to be a first-order citizen on the Web and increases discoverability of and accessibility to the unstructured data on the Web. This evolution enables the Linked Data technology to be used as background knowledge bases for unstructured data, notably the texts, available nowadays on the Web. For the Arabic language, the current situation is less brightness; the content of the Arabic language on the Web doesn't reflect the importance of this language. Given the fact that Arabic is one of the most important languages in the Web, and unfortunately it is under-resourced, so creating linguistic resources for it now is a necessity. Thus, we developed a linguistic approach for annotating Arabic textual corpus with Linked Data, especially DBpedia, which is Linked Open Data (LOD) extracted from Wikipedia. This approach uses natural language techniques to shedding light on Arabic text with Linked Open Data. The evaluation results of this approach are encouraging, despite the high complexity of our independent-domain knowledge base and the reduced resources in Arabic natural language processing. © 2020 IEEE.",Final,,
Kancheva Z.; Radev I.,Linguistic vs Encyclopaedic Knowledge. Classification of MWEs from Wikipedia Articles,1,1,1,#use,2020,https://www.scopus.com/inward/record.uri?eid=2-s2.0-85098103687&doi=10.2478%2fcait-2020-0051&partnerID=40&md5=a78ab248628da4eb3d98a025ca7a4b6d,"This paper reports on the first steps in the creation of linked data through the mapping between the synsets of BTB-WordNet and the articles in Bulgarian Wikipedia. The task of expanding the BTB-WordNet with encyclopaedic knowledge is done by mapping its synsets to Wikipedia articles with many MWEs found in the articles and subjected to further analysis. We look for a way to filter the Wikipedia MWEs in the effort of selecting the ones most beneficial to the enrichment of BTB-WN. © 2020 Z. Kancheva et al., published by Sciendo 2020.",Final,All Open Access; Gold Open Access,
Winiwarter W.,JAMRED - A Japanese abstract meaning representation EDitor,1,1,1,#use WordNet,2015,https://www.scopus.com/inward/record.uri?eid=2-s2.0-84967225539&doi=10.1145%2f2837185.2837246&partnerID=40&md5=eae858b0144bbc20b9a769a5da793aa3,"Meaning Representation (AMR) has emerged recently as one of the most influential formalisms for the semantic representation of natural language. In this paper, we present a Web-based environment for the annotation of Japanese Web pages using augmented browsing and logic programming as the two key enabling technologies. We have developed a visual AMR editor strongly integrated into our Web-based Japanese language learning environment, which hides most of the complexities of AMR syntax from the user and extends it by grounding concepts through links to WordNet synsets and DBpedia resources. The resulting tool can be used meaningfully for several language engineering tasks, in particular, language learning, corpus annotation, and translation. © 2015 ACM.",Final,,
Winiwarter W.,JILL - Japanese incidental language learning,1,1,1,#use,2015,https://www.scopus.com/inward/record.uri?eid=2-s2.0-84967145274&doi=10.1145%2f2837185.2837191&partnerID=40&md5=57f44e22da2b1e839b9e93bfae6dced2,"We present aWeb-based environment for incidental learning of Japanese. As the two key enabling technologies we use augmented browsing at the client and logic programming at the server. This way we can create a learning experience which blends foreign language acquisition with the user's everyday browsing activities. Main features presented in this paper are an intuitive visual presentation of sentence structures, comprehensive support at the word level by integrating several lexical resources including DBpedia, and multiple customization options. © 2015 ACM.",Final,,
Presutti V.; Nuzzolese A.G.; Consoli S.; Gangemi A.; Recupero D.R.,From hyperlinks to Semantic Web properties using Open Knowledge Extraction,1,1,1,#use,2016,https://www.scopus.com/inward/record.uri?eid=2-s2.0-84971554079&doi=10.3233%2fSW-160221&partnerID=40&md5=ac1d14b2b6bd082d9df1734161891fb7,"Open information extraction approaches are useful but insufficient alone for populating the Web with machine readable information as their results are not directly linkable to, and immediately reusable from, other Linked Data sources. This work proposes a novel paradigm, named Open Knowledge Extraction, and its implementation (Legalo) that performs unsupervised, open domain, and abstractive knowledge extraction from text for producing machine readable information. The implemented method is based on the hypothesis that hyperlinks (either created by humans or knowledge extraction tools) provide a pragmatic trace of semantic relations between two entities, and that such semantic relations, their subjects and objects, can be revealed by processing their linguistic traces (i.e. the sentences that embed the hyperlinks) and formalised as Semantic Web triples and ontology axioms. Experimental evaluations conducted on validated text extracted from Wikipedia pages, with the help of crowdsourcing, confirm this hypothesis showing high performances. © 2016 - IOS Press and the authors.",Final,All Open Access; Green Open Access,
McCrae J.P.; Cimiano P.; Matteis L.; Navigli R.; Doncel V.R.; Vila-Suero D.; Gracia J.; Abele A.; Vulcu G.; Buitelaar P.,Reconciling Heterogeneous Descriptions of Language Resources,1,1,1,#use #reconciliation,2015,https://www.scopus.com/inward/record.uri?eid=2-s2.0-85037062941&partnerID=40&md5=ed7fb332868691d899ab1410be3ce03d,"Language resources are a cornerstone of linguistic research and for the development of natural language processing tools, but the discovery of relevant resources remains a challenging task. This is due to the fact that relevant metadata records are spread among different repositories and it is currently impossible to query all these repositories in an integrated fashion, as they use different data models and vocabularies. In this paper we present a first attempt to collect and harmonize the metadata of different repositories, thus making them queriable and browsable in an integrated way. We make use of RDF and linked data technologies for this and provide a first level of harmonization of the vocabularies used in the different resources by mapping them to standard RDF vocabularies including Dublin Core and DCAT. Further, we present an approach that relies on NLP and in particular word sense disambiguation techniques to harmonize resources by mapping values of attributes - such as the type, license or intended use of a resource - into normalized values. Finally, as there are duplicate entries within the same repository as well as across different repositories, we also report results of detection of these duplicates. © 2015 Association for Computational Linguistics and Asian Federation of Natural Language Processing.",Final,,
